restaurant_name,restaurant_url,menu_name,menu_type,section,name,description,price
The Merc Saratoga,https://www.themercsaratoga.com/,Brunch Menu,Brunch,SHAREABLES,BISCUIT BASKET,Served With A Seasonal Butter,$9
The Merc Saratoga,https://www.themercsaratoga.com/,Brunch Menu,Brunch,SHAREABLES,CHICKEN WINGS,Buffalo | Garlic Parm | Nashville Hot,$14
The Merc Saratoga,https://www.themercsaratoga.com/,Brunch Menu,Brunch,SHAREABLES,CRISPY BRUSSELS SPROUTS,"Crispy Seasoned Brussels Sprouts, Honey Mustard",$14
The Merc Saratoga,https://www.themercsaratoga.com/,Brunch Menu,Brunch,SHAREABLES,TRUFFLE FRIES,"Grana Padano, Truffle Oil, Fried Egg, Roasted Rosemary Garlic Aioli",$16
The Merc Saratoga,https://www.themercsaratoga.com/,Brunch Menu,Brunch,SHAREABLES,DEVILED EGGS,"Arugula, Crispy Smoked Bacon, Heirloom Cherry Tomatoes, House-Made Pickles",$13
The Merc Saratoga,https://www.themercsaratoga.com/,Brunch Menu,Brunch,SHAREABLES,AVOCADO TOAST,"Toasted Wheatberry Bread, Smashed Avocado, Cucumber, Heirloom Cherry Tomatoes, Microgreens",$14
The Merc Saratoga,https://www.themercsaratoga.com/,Brunch Menu,Brunch,SALADS,SEASONAL SALAD,"Roasted Beets, Goat Cheese, Bacon Lardons, Candied Pecans, Mixed Greens, Balsamic Vinaigrette",$17
The Merc Saratoga,https://www.themercsaratoga.com/,Brunch Menu,Brunch,SALADS,WEDGE,"Iceberg, Spiced Honey, Bacon Lardons, Walnuts, Cherry Tomatoes, Granny Smith Apples, Blue Cheese Dressing",$16
The Merc Saratoga,https://www.themercsaratoga.com/,Brunch Menu,Brunch,SALADS,NICOISE,"Harvest Greens, Soft Boiled Egg, Heirloom Cherry Tomatoes, Greek Olives, Potatoes, Quinoa, Red Wine Mustard Vinaigrette, Fried Capers",$16
The Merc Saratoga,https://www.themercsaratoga.com/,Brunch Menu,Brunch,SALADS,BABY KALE CAESAR,"Baby Kale, White Anchovy, Parmigiano, House Croutons",$15
The Merc Saratoga,https://www.themercsaratoga.com/,Brunch Menu,Brunch,SWEETS,BUTTERMILK PANCAKES,,$14
The Merc Saratoga,https://www.themercsaratoga.com/,Brunch Menu,Brunch,SWEETS,BRIOCHE FRENCH TOAST,,$14
The Merc Saratoga,https://www.themercsaratoga.com/,Brunch Menu,Brunch,SWEETS,CHICKEN & WAFFLES,,$19
The Merc Saratoga,https://www.themercsaratoga.com/,Brunch Menu,Brunch,FROM THE HEN,EGGS YOUR WAY,"Two Eggs, Choice of Meat & Toast",$14
The Merc Saratoga,https://www.themercsaratoga.com/,Brunch Menu,Brunch,FROM THE HEN,THE MERC OMELETTE,"Bacon, Arugula, Tomato, Cheddar, Herb Oil, Choice of Toast",$15
The Merc Saratoga,https://www.themercsaratoga.com/,Brunch Menu,Brunch,FROM THE HEN,FRIENDS WITH BENEDICTS,"Poached Eggs, Toasted English Muffin, Hollandaise, Smoked Canadian Bacon",$17
The Merc Saratoga,https://www.themercsaratoga.com/,Brunch Menu,Brunch,FROM THE HEN,CARNITAS BENNY,"Poached Eggs, Toasted English Muffin, House-Smoked Pork, Chipotle Hollandaise, Pickled Red Onion, Chives",$19
The Merc Saratoga,https://www.themercsaratoga.com/,Brunch Menu,Brunch,FROM THE HEN,BREAKFAST SAMMY,"Brioche Bun, Two Fried Eggs, Choice of Meat and Cheese",$15
The Merc Saratoga,https://www.themercsaratoga.com/,Brunch Menu,Brunch,FROM THE HEN,BREAKFAST BLT,"Sourdough, Two Fried Eggs, Arugula, Bacon, Tomato, Pesto Mayo",$17
The Merc Saratoga,https://www.themercsaratoga.com/,Brunch Menu,Brunch,FROM THE HEN,BREAKFAST BURRITO,"Scrambled Eggs, Applewood Smoked Bacon, Cheddar, Red Rice, Black Beans, Smashed Avocado, Pico De Gallo, Salsa Verde, Salsa Roja, Sour Cream, Cotija Cheese",$19
The Merc Saratoga,https://www.themercsaratoga.com/,Brunch Menu,Brunch,FROM THE HEN,BISCUITS & GRAVY,"Two Eggs Over Buttermilk Biscuits, Sage Sausage Gravy",$18
The Merc Saratoga,https://www.themercsaratoga.com/,Brunch Menu,Brunch,FROM THE HEN,NO HUEVOS RANCHEROS,"Butternut Squash, Black Beans, Spinach, Quinoa, Caramelized Onions, Soy Chorizo, Smashed Avocado, Pico De Gallo, Choice of Toast",$18
The Merc Saratoga,https://www.themercsaratoga.com/,Brunch Menu,Brunch,SAMMIES,THE MERC BURGER,"2 Smashed Patties, House-Made Pickles, Comeback Sauce, American, Brioche Bun",$19
The Merc Saratoga,https://www.themercsaratoga.com/,Brunch Menu,Brunch,SAMMIES,SARATOGA SMASH,"2 Smashed Patties, Maple Bacon jam, Pickled Red Onion, Arugula, Garlic Rosemary Aioli, Smoked Cheddar, Brioche Bun",$24
The Merc Saratoga,https://www.themercsaratoga.com/,Brunch Menu,Brunch,SAMMIES,CRISPY CHICKEN SANDWICH,"Coleslaw, House-Made Pickles, White BBQ Sauce",$19
The Merc Saratoga,https://www.themercsaratoga.com/,Brunch Menu,Brunch,SAMMIES,ADULT GRILLED CHEESE,"Sourdough, Swiss, Cheddar, Caramelized Onions, Rosemary Butter",$18
The Merc Saratoga,https://www.themercsaratoga.com/,Brunch Menu,Brunch,SAMMIES,BBQ PULLED PORK,"House-Smoked Pork, Carolina BBQ Sauce, Coleslaw",$19
The Merc Saratoga,https://www.themercsaratoga.com/,Brunch Menu,Brunch,SAMMIES,QUINOA BLACK BEAN BURGER,"Smashed Avocado, Crispy Onions, Pico De Gallo, Veganaise",$19
The Merc Saratoga,https://www.themercsaratoga.com/,Brunch Menu,Brunch,SIDES,"Bacon, Sausage Links, Canadian Bacon",,$4
The Merc Saratoga,https://www.themercsaratoga.com/,Brunch Menu,Brunch,SIDES,"Toast (Sourdough, Wheatberry, Rye, Gluten Free)",,$2
The Merc Saratoga,https://www.themercsaratoga.com/,Brunch Menu,Brunch,SIDES,"Breakfast Potatoes, Tater Tots, Fries",,$6
The Merc Saratoga,https://www.themercsaratoga.com/,Brunch Menu,Brunch,SIDES,Buttermilk Biscuit,,$3
The Merc Saratoga,https://www.themercsaratoga.com/,Brunch Menu,Brunch,SIDES,French Toast,,$6
The Merc Saratoga,https://www.themercsaratoga.com/,Brunch Menu,Brunch,SIDES,Pancake,,$7
The Merc Saratoga,https://www.themercsaratoga.com/,Brunch Menu,Brunch,SIDES,Waffle,,$8
The Merc Saratoga,https://www.themercsaratoga.com/,Dinner Menu,Dinner,SNACKS,MARINATED OLIVES,"Assorted Olives, Seasoned Olive Oil",$7
The Merc Saratoga,https://www.themercsaratoga.com/,Dinner Menu,Dinner,SNACKS,FRIED PICKLES,"Battered House-Made Pickles, Side of Comeback Sauce",$7
The Merc Saratoga,https://www.themercsaratoga.com/,Dinner Menu,Dinner,APPETIZERS,TOMATO BISQUE,"Herb Oil, Balsamic Glaze, Herbed Crostini",$8 | $11
The Merc Saratoga,https://www.themercsaratoga.com/,Dinner Menu,Dinner,APPETIZERS,CHICKEN WINGS,Buffalo | Garlic Parm | Nashville Hot,$14
The Merc Saratoga,https://www.themercsaratoga.com/,Dinner Menu,Dinner,APPETIZERS,CRISPY BRUSSEL SPROUTS,"Crispy Seasoned Brussel Sprouts, Honey Mustard",$14
The Merc Saratoga,https://www.themercsaratoga.com/,Dinner Menu,Dinner,APPETIZERS,TRUFFLE FRIES,"Grana Padano, Truffle Oil, Fried Egg, Roasted Rosemary Garlic Aioli",$16
The Merc Saratoga,https://www.themercsaratoga.com/,Dinner Menu,Dinner,APPETIZERS,DEVILED EGGS,"Arugula, Crispy Smoked Bacon, Heirloom Cherry Tomatoes, House-Made Pickles",$13
The Merc Saratoga,https://www.themercsaratoga.com/,Dinner Menu,Dinner,APPETIZERS,SWEET POTATO CROQUETTE,"Smoked Cheddar, Hot Honey, Cajun Remoulade",$15
The Merc Saratoga,https://www.themercsaratoga.com/,Dinner Menu,Dinner,APPETIZERS,SPINACH ARTICHOKE DIP,Served With Crostini,$15
The Merc Saratoga,https://www.themercsaratoga.com/,Dinner Menu,Dinner,APPETIZERS,PIGS IN A BLANKET,Jalapeno-Cheddar Sauce & Honey Mustard Sauce,$15
The Merc Saratoga,https://www.themercsaratoga.com/,Dinner Menu,Dinner,APPETIZERS,MUSSELS,"Garlic, Lemon, White Wine, Fennel Pollen, Crostini",$18
The Merc Saratoga,https://www.themercsaratoga.com/,Dinner Menu,Dinner,SALADS,SEASONAL SALAD,"Roasted Beets, Goat Cheese, Bacon Lardons, Candied Pecans, Mixed Greens, Balsamic Vinaigrette",$17
The Merc Saratoga,https://www.themercsaratoga.com/,Dinner Menu,Dinner,SALADS,WEDGE,"Iceberg, Spiced Honey, Bacon Lardons, Walnuts, Cherry Tomatoes, Granny Smith Apples, Blue Cheese Dressing",$16
The Merc Saratoga,https://www.themercsaratoga.com/,Dinner Menu,Dinner,SALADS,NICOISE,"Harvest Greens, Soft Boiled Egg, Heirloom Cherry Tomatoes, Greek Olives, Potatoes, Quinoa, Red Wine Mustard Vinaigrette, Fried Capers",$16
The Merc Saratoga,https://www.themercsaratoga.com/,Dinner Menu,Dinner,SALADS,BABY KALE CAESAR,"Baby Kale, White Anchovy, Parmigiano, House Croutons",$15
The Merc Saratoga,https://www.themercsaratoga.com/,Dinner Menu,Dinner,SAMMIES,THE MERC BURGER,"2 Smashed Patties, House-Made Pickles, Comeback Sauce, American, Brioche Bun",$19
The Merc Saratoga,https://www.themercsaratoga.com/,Dinner Menu,Dinner,SAMMIES,SARATOGA SMASH,"2 Smashed Patties, Maple Bacon Jam, Pickled Red Onion, Arugula, Garlic Rosemary Aioli, Smoked Cheddar, Brioche Bun",$24
The Merc Saratoga,https://www.themercsaratoga.com/,Dinner Menu,Dinner,SAMMIES,CRISPY CHICKEN SANDWICH,"Coleslaw, House-Made Pickles, White BBQ Sauce",$19
The Merc Saratoga,https://www.themercsaratoga.com/,Dinner Menu,Dinner,SAMMIES,ADULT GRILLED CHEESE,"Sourdough, Swiss, Cheddar, Caramelized Onions, Rosemary Butter",$18
The Merc Saratoga,https://www.themercsaratoga.com/,Dinner Menu,Dinner,SAMMIES,BBQ PULLED PORK,"House-Smoked Pork, Carolina BBQ Sauce, Coleslaw",$19
The Merc Saratoga,https://www.themercsaratoga.com/,Dinner Menu,Dinner,SAMMIES,QUINOA BLACK BEAN BURGER,"Smashed Avocado, Crispy Onions, Pico De Gallo, Veganaise",$19
The Merc Saratoga,https://www.themercsaratoga.com/,Dinner Menu,Dinner,ENTREES,FRIED CHICKEN & GRAVY,"Sausage Gravy, Brussels Sprouts, Buttermilk Biscuit",$27
The Merc Saratoga,https://www.themercsaratoga.com/,Dinner Menu,Dinner,ENTREES,JAMBALAYA,"Andouille Sausage, Shrimp, Holy Trinity, Tomato Stew, Rice",$29
The Merc Saratoga,https://www.themercsaratoga.com/,Dinner Menu,Dinner,ENTREES,HERB-CRUSTED SALMON,"Crusted Atlantic Salmon, Mashed Potatoes, Escarole & Beans",$36
The Merc Saratoga,https://www.themercsaratoga.com/,Dinner Menu,Dinner,ENTREES,BRAISED SHORT RIB,"Mashed Potatoes, Heirloom Carrots, Veal Demi",$39
The Merc Saratoga,https://www.themercsaratoga.com/,Dinner Menu,Dinner,ENTREES,STEAK FRITES,"14oz Prime NY Strip, French Fries, Chimichurri",$48
The Merc Saratoga,https://www.themercsaratoga.com/,Dinner Menu,Dinner,ENTREES,PORK CHOP,"Mashed Sweet Potatoes, Broccolini, Spicy BBQ",$37
The Merc Saratoga,https://www.themercsaratoga.com/,Dinner Menu,Dinner,DESSERT,FRENCH TOAST BREAD PUDDING,"Granny Smith Apples, Cinnamon Custard, Topped With Candied Walnuts, Maple Syrup, Powdered Sugar",$10
The Merc Saratoga,https://www.themercsaratoga.com/,Dinner Menu,Dinner,DESSERT,CHOCOLATE MOUSSE CAKE,"Triple Layer, Chocolate Mousse Filling, Chocolate Ganache",$10
The Merc Saratoga,https://www.themercsaratoga.com/,Dinner Menu,Dinner,DESSERT,MIXED BERRY TART,"Filled With Vanilla Cream, Assorted Berries",$10
The Merc Saratoga,https://www.themercsaratoga.com/,Dinner Menu,Dinner,SIDES,Broccolini,,$8
The Merc Saratoga,https://www.themercsaratoga.com/,Dinner Menu,Dinner,SIDES,Mashed Potatoes,,$8
The Merc Saratoga,https://www.themercsaratoga.com/,Dinner Menu,Dinner,SIDES,Mashed Sweet Potatoes,,$8
The Merc Saratoga,https://www.themercsaratoga.com/,Dinner Menu,Dinner,SIDES,Heirloom Carrots,,$8
The Merc Saratoga,https://www.themercsaratoga.com/,Dinner Menu,Dinner,SIDES,Escarole & Beans,,$8
The Merc Saratoga,https://www.themercsaratoga.com/,Dinner Menu,Dinner,SIDES,Fries & Tots,,$6
The Merc Saratoga,https://www.themercsaratoga.com/,Dinner Menu,Dinner,SIDES,Truffle Fries & Tots,,$8
The Merc Saratoga,https://www.themercsaratoga.com/,Dinner Menu,Dinner,SIDES,Brussels Sprouts,,$8
The Merc Saratoga,https://www.themercsaratoga.com/,Dinner Menu,Dinner,SIDES,Sausage Gravy,,$6
The Merc Saratoga,https://www.themercsaratoga.com/,Dinner Menu,Dinner,SIDES,Jambalaya,,$10
The Merc Saratoga,https://www.themercsaratoga.com/,Cocktails Menu,Cocktails,BRUNCH COCKTAILS,MIMOSA,"OJ, Blood Orange, Apple Cider or Cranberry",$39
The Merc Saratoga,https://www.themercsaratoga.com/,Cocktails Menu,Cocktails,BRUNCH COCKTAILS,BELLINI,"Peach Nectar, Prosecco",$39
The Merc Saratoga,https://www.themercsaratoga.com/,Cocktails Menu,Cocktails,BRUNCH COCKTAILS,BLOODY MARY,"Vodka, The Merc Bloody Mary Mix",$14
The Merc Saratoga,https://www.themercsaratoga.com/,Cocktails Menu,Cocktails,BRUNCH COCKTAILS,FLORADORA,"Gin, Raspberry, Lime, Ginger Beer",$14
The Merc Saratoga,https://www.themercsaratoga.com/,Cocktails Menu,Cocktails,BRUNCH COCKTAILS,APEROL SPRITZ,"Aperol, Prosecco, Club Soda",$14
The Merc Saratoga,https://www.themercsaratoga.com/,Cocktails Menu,Cocktails,BRUNCH COCKTAILS,HUGO SPRITZ,"Prosecco, Elderflower, Lime, Mint, Club Soda",$14
The Merc Saratoga,https://www.themercsaratoga.com/,Cocktails Menu,Cocktails,BRUNCH COCKTAILS,MARGARITA,"Tequila, Triple Sec, Lime",$14
The Merc Saratoga,https://www.themercsaratoga.com/,Cocktails Menu,Cocktails,BRUNCH COCKTAILS,Flavors +1,"MOSCOW MULE 14 Vodka, Lime, Fever Tree Ginger Beer",$1
The Merc Saratoga,https://www.themercsaratoga.com/,Cocktails Menu,Cocktails,BRUNCH COCKTAILS,Flavors +1,,$1
The Merc Saratoga,https://www.themercsaratoga.com/,Cocktails Menu,Cocktails,BRUNCH COCKTAILS,THE ESPRESSO MARTINI,"Vodka, Coffee Liqueur, Espresso",$15
The Merc Saratoga,https://www.themercsaratoga.com/,Cocktails Menu,Cocktails,BRUNCH COCKTAILS,IRISH COFFEE,"Irish Whiskey, Demerara, Dark Roast, Heavy Cream",$11
The Merc Saratoga,https://www.themercsaratoga.com/,Cocktails Menu,Cocktails,BRUNCH COCKTAILS,GRASSHOPPER,"Peppermint, Cocao, Cream, Chocolate Shavings",$14
The Merc Saratoga,https://www.themercsaratoga.com/,Cocktails Menu,Cocktails,THE CLASSICS,MARGARITA,"Tequila, Triple Sec, Lime",$14
The Merc Saratoga,https://www.themercsaratoga.com/,Cocktails Menu,Cocktails,THE CLASSICS,Seasonal Flavor +1:,,$1
The Merc Saratoga,https://www.themercsaratoga.com/,Cocktails Menu,Cocktails,THE CLASSICS,MOSCOW MULE,"Vodka, Lime, Fever Tree Ginger Beer",$14
The Merc Saratoga,https://www.themercsaratoga.com/,Cocktails Menu,Cocktails,THE CLASSICS,Seasonal Flavor +1:,,$1
The Merc Saratoga,https://www.themercsaratoga.com/,Cocktails Menu,Cocktails,THE CLASSICS,OLD FASHIONED,"Bourbon, Demerara, Bitters Blend",$14
The Merc Saratoga,https://www.themercsaratoga.com/,Cocktails Menu,Cocktails,THE CLASSICS,AMERICAN TRILOGY,"Apple Brandy, Rye, Demerara, Orange BItters",$14
The Merc Saratoga,https://www.themercsaratoga.com/,Cocktails Menu,Cocktails,THE CLASSICS,PENECILLIN,"Bourbon, Ginger, Honey, Lemon, Islay Spritz",$14
The Merc Saratoga,https://www.themercsaratoga.com/,Cocktails Menu,Cocktails,THE CLASSICS,PAPER PLANE,"Bourbon, Amaro, Aperol, Lemon",$14
The Merc Saratoga,https://www.themercsaratoga.com/,Cocktails Menu,Cocktails,THE CLASSICS,DARK & STORMY,"Dark Rum, Ginger, Lime, Club, Bitters",$14
The Merc Saratoga,https://www.themercsaratoga.com/,Cocktails Menu,Cocktails,THE CLASSICS,BEES KNEES,"Gin, Honey, Lemon",$14
The Merc Saratoga,https://www.themercsaratoga.com/,Cocktails Menu,Cocktails,THE CLASSICS,APEROL SPRITZ,"Aperol, Prosecco, Club Soda",$14
The Merc Saratoga,https://www.themercsaratoga.com/,Cocktails Menu,Cocktails,THE CLASSICS,HUGO SPRITZ,"Prosecco, Elderflower, Lime, Mint, Club Soda",$14
The Merc Saratoga,https://www.themercsaratoga.com/,Cocktails Menu,Cocktails,THE CLASSICS,THE ESPRESSO MARTINI,"Vodka, Coffee Liqueur, Espresso",$15
The Merc Saratoga,https://www.themercsaratoga.com/,Cocktails Menu,Cocktails,SIGNATURE COCKTAILS,THE ALIBI,"Rye, Sweet Vermouth, Amaro, Maple, Bitters Blend",$16
The Merc Saratoga,https://www.themercsaratoga.com/,Cocktails Menu,Cocktails,SIGNATURE COCKTAILS,TAKING THE CURE,"Bourbon, Rye, Ginger, Lemon, Almond",$16
The Merc Saratoga,https://www.themercsaratoga.com/,Cocktails Menu,Cocktails,SIGNATURE COCKTAILS,SNAP DECISION,"Gin, Snap Pea, Lime, Mint",$16
The Merc Saratoga,https://www.themercsaratoga.com/,Cocktails Menu,Cocktails,SIGNATURE COCKTAILS,MINT CONDITION,"Vodka, Peppermint, Cocao, Espresso",$16
The Merc Saratoga,https://www.themercsaratoga.com/,Cocktails Menu,Cocktails,SIGNATURE COCKTAILS,SCARLET SOLSTICE,"Tequila, Aperol, Raspberry, Lime",$16
The Merc Saratoga,https://www.themercsaratoga.com/,Cocktails Menu,Cocktails,SIGNATURE COCKTAILS,FIRESIDE GLOW,"Bourbon, Pear, Honey, Lemon, Bitters",$16
The Merc Saratoga,https://www.themercsaratoga.com/,Cocktails Menu,Cocktails,SIGNATURE COCKTAILS,BERRY BITTER,"Gin, Campari, Blackberry",$15
The Merc Saratoga,https://www.themercsaratoga.com/,Beer & Wine Menu,Beer & Wine,ON TAP,JUICE BOMB,,$8
The Merc Saratoga,https://www.themercsaratoga.com/,Beer & Wine Menu,Beer & Wine,ON TAP,FIDDLEHEAD,,$8
The Merc Saratoga,https://www.themercsaratoga.com/,Beer & Wine Menu,Beer & Wine,ON TAP,ALLAGASH WHITE,,$8
The Merc Saratoga,https://www.themercsaratoga.com/,Beer & Wine Menu,Beer & Wine,ON TAP,POST SHIFT,,$8
The Merc Saratoga,https://www.themercsaratoga.com/,Beer & Wine Menu,Beer & Wine,ON TAP,WOLF HOLLOW,,$8
The Merc Saratoga,https://www.themercsaratoga.com/,Beer & Wine Menu,Beer & Wine,ON TAP,CHERRY RAZZ,,$8
The Merc Saratoga,https://www.themercsaratoga.com/,Beer & Wine Menu,Beer & Wine,ON TAP,PEACH CRUSHER,,$8
The Merc Saratoga,https://www.themercsaratoga.com/,Beer & Wine Menu,Beer & Wine,ON TAP,MAD ELF,,$10
The Merc Saratoga,https://www.themercsaratoga.com/,Beer & Wine Menu,Beer & Wine,ON TAP,GUINNESS,,$8
The Merc Saratoga,https://www.themercsaratoga.com/,Beer & Wine Menu,Beer & Wine,BOTTLES & CANS,NEON RAINBOWS,,$8
The Merc Saratoga,https://www.themercsaratoga.com/,Beer & Wine Menu,Beer & Wine,BOTTLES & CANS,FLOWER POWER,,$8
The Merc Saratoga,https://www.themercsaratoga.com/,Beer & Wine Menu,Beer & Wine,BOTTLES & CANS,MOBIUS,,$11
The Merc Saratoga,https://www.themercsaratoga.com/,Beer & Wine Menu,Beer & Wine,BOTTLES & CANS,NEW YORK,,$8
The Merc Saratoga,https://www.themercsaratoga.com/,Beer & Wine Menu,Beer & Wine,BOTTLES & CANS,TASTEFUL DECEPTION,,$9
The Merc Saratoga,https://www.themercsaratoga.com/,Beer & Wine Menu,Beer & Wine,BOTTLES & CANS,COORS LIGHT,,$6
The Merc Saratoga,https://www.themercsaratoga.com/,Beer & Wine Menu,Beer & Wine,BOTTLES & CANS,MILLER LITE,,$6
The Merc Saratoga,https://www.themercsaratoga.com/,Beer & Wine Menu,Beer & Wine,BOTTLES & CANS,CORONA,,$6
The Merc Saratoga,https://www.themercsaratoga.com/,Beer & Wine Menu,Beer & Wine,BOTTLES & CANS,NINE PIN,,$9
The Merc Saratoga,https://www.themercsaratoga.com/,Beer & Wine Menu,Beer & Wine,BOTTLES & CANS,SURFSIDE,,$7
The Merc Saratoga,https://www.themercsaratoga.com/,Beer & Wine Menu,Beer & Wine,BOTTLES & CANS,ATHLETIC BREWING,,$6
The Merc Saratoga,https://www.themercsaratoga.com/,Beer & Wine Menu,Beer & Wine,BOTTLES & CANS,ATHLETIC BREWING,,$6
The Merc Saratoga,https://www.themercsaratoga.com/,Beer & Wine Menu,Beer & Wine,BOTTLES & CANS,ATHLETIC BREWING,,$6
